{
  "source_type": "internal",
  "source_ref": "hypervisor-zoverions-lens",
  "immutable_digest": "zov1234567890abcdef",
  "captured_at": "2026-03-22T00:00:00Z",
  "upstream_signature": {
    "present": true,
    "algorithm": "ecdsa-sha256",
    "key_id": "zoverions",
    "valid": true
  },
  "declared_authority": [
    "data_read",
    "data_write",
    "tool_exec"
  ]
}
